Customer Name,Date,Customer ID,Email Address,Phone Number,Shipping Address,Order Number,Issue Reported,Service Representative,Response Time,Resolution,Follow-up Needed,Customer Feedback,
Ethan Johnson,11/7/24,782011,ethan.johnson@email.com,-4109,"134 Oak Street, Portland, OR 97204",4578342890," Ethan contacted customer service to report a recurring problem with his washing machine, Model EcoWash 300. He mentioned that during the spin cycle, the machine produces a loud, irregular banging noise. Ethan initially thought the noise might be related to something inside the drum, so he checked the drum for foreign objects like coins or small clothing items. He conﬁrmed that no objects were present. However, the noise continues to persist even with minimal loads. He is concerned that the issue could be related to the suspension system or drum assembly, potentially causing damage to the internal components if not addressed soon. Ethan requested a technician visit to prevent further damage and to get a professional diagnosis. ",Jane Cooper,15 minutes," Jane took the time to walk Ethan through a detailed troubleshooting process, including verifying the load size and checking the balance of the washing machine. She explained that unbalanced loads can sometimes cause unusual noise during the spin cycle. However, since the issue persisted even with small loads, she advised him to check the drum suspension system and ensure that it was properly secured. Jane further explained that if the drum or suspension system had become misaligned or the shock absorbers were worn out, this could cause the banging noise. Realizing the issue might require more complex intervention, Jane scheduled a technician visit to perform a more thorough inspection of the internal components, including the suspension springs and drum motor. ","Yes, technician visit scheduled for drum suspension and motor"," Rating: 4 Comments: ""Service was prompt, but I'm worried it might be a bigger issue with the drum. Hope it gets ﬁxed soon."" Source System: CRM  ---  ### Customer Service Log 2 Customer Information",
Sophia Wilson,11/8/24,785673,sophia.wilson@email.com,-5331,"1025 Pine Avenue, San Francisco, CA 94107",4678452100," Sophia reported an issue with her SmartWash 500, which has been malfunctioning during its washing cycle. Speciﬁcally, the machine displays the error code ""E4"" after completing the cycle, which indicates a drainage problem. Despite attempting to troubleshoot on her own, including checking the drain ﬁlter and ensuring the drain hose was clear of obstructions, the issue persists. Sophia mentioned that there is also water left in the drum after the cycle ﬁnishes. She is concerned that it might be an issue with the pump motor or a deeper internal blockage. ",Peter Foster,30 minutes," Peter explained that the E4 error code typically indicates a drainage issue, often due to a clogged or blocked drain hose or ﬁlter. After walking Sophia through the steps to clean the ﬁlter and ensure no external blockages were present, he conﬁrmed that the issue was still unresolved. He hypothesized that the issue could be related to the pump motor, which may not be functioning properly to expel the water. Peter emphasized that if the motor had failed, the water would not be drained ebiciently, leading to standing water in the drum. He arranged for a technician to inspect the internal pump motor and check for any blockages or malfunctioning parts that might be abecting the drainage. Peter assured Sophia that the technician would be able to further diagnose the problem and ober a solution. ","Yes, technician visit scheduled to inspect the pump motor and"," Rating: 5 Comments: ""Great help from Peter! Hope the technician resolves the issue."" Source System: CRM  ---  ### Customer Service Log 3 Customer Information",
Liam Smith,11/6/24,781924,liam.smith@email.com,-6553,"432 Birch Road, Los Angeles, CA 90001",4589231843," Liam’s QuickWash 700 washing machine has been experiencing an issue where it intermittently stops mid-cycle and does not complete the wash. He reported that the cycle halts after about 15 minutes, and he is forced to restart the machine manually, only for it to happen again. Liam checked the load balance and even tried running the machine with smaller loads, but the problem persists. He suspects that the issue might be related to the control board or an internal sensor malfunction that is causing the cycle to terminate prematurely. ",Emily Davis,20 minutes," Emily took the time to explain to Liam that one possible cause for a washing machine to stop mid-cycle is a faulty control board or a malfunctioning sensor that fails to communicate the proper cycle status. She walked Liam through a series of checks to verify whether the machine was properly loaded or if any speciﬁc wash settings might be triggering the premature shutdown. After ruling out the simpler causes, Emily acknowledged that the problem might lie within the machine’s electronic control system. She advised Liam to keep track of the error codes, if any, that appeared on the display. Emily escalated the issue for a more in-depth inspection of the control board and its connections, as well as a sensor diagnostic. She arranged for a technician to visit and diagnose the problem further. ","Yes, technician visit scheduled to inspect the control board and"," Rating: 3 Comments: ""The service was quick, but I’m still unsure if the issue will be ﬁxed. It keeps happening."" Source System: CRM  ---  ### Customer Service Log 4 Customer Information",
Isabella Martinez,11/9/24,783210,isabella.martinez@email.com,-7775,"785 Oak Drive, Chicago, IL 60601",4599872301," Isabella reached out regarding her SmartWash 200 washing machine, which is failing to spin correctly. After completing the washing cycle, her clothes are still wet and heavy. Isabella mentioned that the drum doesn’t seem to be spinning at all, even when she tries to set the machine to a spin cycle manually. She noted that the drainage seems ﬁne, and there are no unusual noises during the cycle, which led her to believe the problem could be with the spin motor or drive belt. ",Peter Foster,40 minutes," Peter ﬁrst conﬁrmed that Isabella had checked for any obvious external blockages in the drain and the drum, and all appeared ﬁne. He then walked her through testing the spin cycle to see if the machine would respond when set to high spin speed. After determining that the drum was indeed not turning, Peter suspected that the issue might lie with either the spin motor or the drive belt. He explained that if the motor was malfunctioning, it would prevent the drum from spinning at all, even though the rest of the machine seemed to be operating normally. Given the nature of the issue, Peter scheduled a technician visit to further investigate the motor and drive belt system. ","Yes, technician visit scheduled to inspect the spin motor and drive"," Rating: 5 Comments: ""Excellent service and advice. Hopefully the technician can ﬁx it soon."" Source System: CRM  ---  ### Customer Service Log 5 Customer Information",
Noah White,11/10/24,780512,noah.white@email.com,-10219,"912 Willow Lane, Miami, FL 33101",4602741920," Noah’s SuperClean 800 washing machine has been experiencing intermittent water leakage around the door seal during the wash cycle. He observed that after each wash, water begins to pool around the base of the washing machine. Despite checking the door seal for any visible cracks or damage, he has not been able to identify the source of the leak. He also conﬁrmed that the water inlet valve is functioning correctly. Noah expressed concern that the issue might be due to a defective seal or an issue with the drum assembly causing the leakage  . ",Laura Simmons,10 minutes," Laura advised Noah to carefully inspect the door seal and ensure that no detergent or fabric softener had built up in the rubber, as that could cause poor sealing and leakage. After conﬁrming that the seal appeared clean and in good condition, Laura suspected that the issue could be related to improper drum alignment or even a small crack in the seal that was dibicult to detect. She scheduled a technician visit to replace the seal and inspect the drum alignment to prevent future leaks. ","Yes, technician visit scheduled for door seal replacement and drum"," Rating: 2 Comments: ""I’m really frustrated. This issue has been ongoing for weeks and still isn’t resolved."" Source System: CRM  ---  These logs now include more detailed issues and resolutions, which are useful for analysis and decision-making.  Sure! Here are 5 more customer service logs with detailed issues and resolutions, including a variety of feedback:  ---  ### Customer Service Log 6 Customer Information",
Mia Green,11/10/24,787654,mia.green@email.com,-2664,"212 Cedar Way, Austin, TX 78701",4698765432," Mia reported that her EcoWash 1000 washing machine has started to vibrate excessively during the spin cycle. She mentioned that it was noticeable even with smaller loads of laundry, and the vibration causes the machine to move slightly across the ﬂoor. Mia checked that the machine was level, and the ﬂoor seemed solid, so she suspected that the issue could be related to the shock absorbers or suspension system, which might not be absorbing the vibrations properly. ",Kevin Mitchell,25 minutes," Kevin walked Mia through some troubleshooting steps to check if the machine was perfectly level and if the laundry was balanced. After conﬁrming that the machine was indeed level and the load was balanced, Kevin suspected that the issue could be with the shock absorbers or the suspension springs, which could have worn out over time and were no longer absorbing the vibrations. He scheduled a technician visit to inspect and replace the faulty components. Kevin also recommended that Mia avoid overloading the machine until the issue is resolved, as that could further stress the system. ","Yes, technician visit scheduled to inspect and replace shock"," Rating: 4 Comments: ""The service was helpful, but I’m hoping the issue will be fully resolved with the new parts. It’s been a bit of a nuisance."" Source System: CRM  ---  ### Customer Service Log 7 Customer Information",
Daniel Thomas,11/11/24,788901,daniel.thomas@email.com,-9219,"520 Maple Road, Denver, CO 80205",4692345678," Daniel's QuickWash 800 washing machine has started to stop halfway through its wash cycle. He noted that it happens frequently, regardless of the type of load or wash cycle selected. The washing machine will start the cycle normally, but then it freezes and the timer stops progressing. Daniel conﬁrmed that the power supply is stable and the machine is correctly plugged in. He suspected that the control board or timer could be malfunctioning, causing the machine to halt unexpectedly. ",Sarah Lewis,15 minutes," Sarah explained that the issue could indeed be related to a malfunctioning control board or timer, as these are the primary components that regulate the wash cycle. Sarah walked Daniel through a few basic steps, such as turning the machine ob for a few minutes and resetting it, but the problem persisted. She recommended that he check for any error codes or ﬂashing lights on the display that might provide more insight into the issue. Sarah escalated the issue for further inspection and arranged for a technician to diagnose the problem with the control board and timer, as they would need to be thoroughly tested and potentially replaced. ","Yes, technician visit scheduled to inspect the control board and"," Rating: 3 Comments: ""The support was helpful, but I’m frustrated the machine keeps stopping. I’ve been waiting for a technician for a while now."" Source System: CRM  ---  ### Customer Service Log 8 Customer Information",
Charlotte Davis,11/12/24,786502,charlotte.davis@email.com,-11330,"1500 Elm Street, New York, NY 10001",4701293847," Charlotte reported that her SmartWash 200 washing machine is experiencing issues with water leakage during the rinse cycle. She noticed water was dripping from the bottom of the door seal while the cycle was running. Charlotte has inspected the door seal and found no visible tears or cracks, but still, the machine continues to leak water. She is concerned that the issue may lie in the water inlet valve or a possible internal gasket problem. ",James Walker,20 minutes," James acknowledged that water leakage during the rinse cycle is often due to a broken door seal or an issue with the water inlet valve. He walked Charlotte through checking for any detergent residue or buildup that might cause improper sealing around the door, but Charlotte conﬁrmed that the seal appeared clean. James explained that sometimes the gasket or internal seals can wear out or become misaligned, causing water to leak out. He recommended a technician visit to inspect both the water inlet valve and the internal seals for potential issues. James also advised Charlotte to check that the door was properly closed before starting the cycle to avoid further leaks. ","Yes, technician visit scheduled to inspect the water inlet valve and"," Rating: 5 Comments: ""The service was very quick and the representative explained everything clearly. I hope the technician can ﬁx the leak soon."" Source System: CRM  ---  ### Customer Service Log 9 Customer Information",
Benjamin Harris,11/10/24,780893,benjamin.harris@email.com,-5220,"934 Maple Ave, Miami, FL 33132",4691273856," Benjamin’s EcoWash 500 washing machine has been displaying an ""E3"" error code, indicating a sensor issue. The error typically appears mid-cycle, and the washing machine stops working. Benjamin attempted a reset of the machine, but the issue continued. He mentioned that the machine would run the cycle for a while, but then it would halt and display the E3 error code without completing the wash. Benjamin believes the problem may be related to a faulty water level sensor or another internal sensor. ",Olivia Taylor,10 minutes," Olivia explained that the E3 error code often indicates a sensor malfunction, especially related to the water level sensor or the pressure switch, which measures the water levels in the drum during a cycle. Olivia walked Benjamin through a series of troubleshooting steps, such as checking the water supply and ensuring the water pressure was subicient. However, since the error persisted, Olivia arranged for a technician visit to thoroughly inspect and test the sensors and wiring to identify the cause of the issue. She also noted that if a faulty sensor was found, it would need to be replaced to restore proper function. ","Yes, technician visit scheduled to inspect and replace faulty"," Rating: 5 Comments: ""The support was excellent. I’m conﬁdent the technician will sort out the issue once and for all."" Source System: CRM  ---  ### Customer Service Log 10 Customer Information",
Grace Clark,11/11/24,789234,grace.clark@email.com,-3998,"600 Oakwood Blvd, San Diego, CA 92101",4697682012," Grace’s QuickWash 900 washing machine has been giving her problems with uneven washes. She reported that no matter what cycle she uses, the clothes come out either soaking wet or still have detergent residue on them. Grace tried adjusting the load size and used the proper detergent, but the problem persisted. She suspects that the issue might be related to an imbalance in the drum or a problem with the dispensing system that isn’t releasing the detergent properly. ",Emma Harris,30 minutes," Emma explained that an uneven wash result could be caused by several factors, including a misaligned drum, water supply issues, or even a clogged detergent dispenser. Emma walked Grace through checking the detergent compartment to make sure it was not clogged or blocked by detergent buildup. She also suggested that Grace check if the load was unbalanced, as this can sometimes cause uneven washing results. Since the issue was more complex, Emma scheduled a technician visit to inspect the drum alignment and the detergent dispensing system for blockages or malfunctions. ","Yes, technician visit scheduled to inspect drum alignment and"," Rating: 2 Comments: ""I’m frustrated with this issue. I’ve tried everything, and the machine still doesn’t wash properly. I hope the technician can ﬁgure it out."" Source System: CRM   ---  ### Customer Service Log 11 Customer Information",
Aiden Walker,11/13/24,790321,aiden.walker@email.com,-7664,"2324 Ashwood Drive, Dallas, TX 75201",4703409821," Aiden contacted customer service about his UltraSpin 1200 washing machine, which is not heating the water properly during the wash cycle. He noticed that even after setting the machine to a hot wash, the clothes were still cold and soapy when the cycle ﬁnished. Aiden conﬁrmed that the water inlet valve was functioning and that the temperature setting on the machine was correct. He suspects that the issue might be with the heating element or a faulty temperature sensor. ",Michelle Adams,18 minutes," Michelle explained that the issue could be caused by a broken heating element or a malfunctioning temperature sensor, both of which would prevent the water from reaching the correct temperature. She walked Aiden through verifying the settings and ensuring that the water supply was properly connected. Since the issue persisted, Michelle recommended that the heating element be inspected, as it might have failed. She scheduled a technician visit to test the element and the temperature sensor and replace any faulty parts. ","Yes, technician visit scheduled to inspect and replace the heating"," Rating: 4 Comments: ""Good support, but I'm hoping the technician can get the heating issue ﬁxed quickly. The laundry’s been piling up!"" Source System: CRM  ---  ### Customer Service Log 12 Customer Information",
Olivia Thompson,11/14/24,791014,olivia.thompson@email.com,-10219,"1030 Riverbend Street, Orlando, FL 32801",4704891342," Olivia reported that her WashPro 700 washing machine is exhibiting strange odors after completing wash cycles. She mentioned that the odor is sour and unpleasant, even though she has regularly cleaned the drum and used the proper detergent. Olivia is worried that the odor might be caused by mold or mildew buildup, but she hasn’t found any visible signs of it. She is concerned that the smell is coming from the drain pump or an issue with the drum gasket, as these are areas that could trap water and promote mold growth. ",Jacob Carter,25 minutes," Jacob explained that mold and mildew odors are often caused by water remaining stagnant in hidden areas, such as the drain pump, drain hose, or drum gasket, which can trap moisture and detergent residue. He recommended that Olivia run a maintenance wash with hot water and vinegar to help eliminate any buildup inside the drum. Jacob also advised checking the drain ﬁlter for any debris that might be obstructing proper drainage. Since the issue persisted, Jacob scheduled a technician visit to inspect the drain pump, gasket, and drain hose for any blockages or signs of mildew buildup. ","Yes, technician visit scheduled to inspect the drain pump, gasket,"," Rating: 3 Comments: ""The advice was helpful, but the odor is still there. Hoping the technician can sort this out quickly."" Source System: CRM  ---  ### Customer Service Log 13 Customer Information",
Henry Lewis,11/15/24,792785,henry.lewis@email.com,-7775,"875 Pine Street, Philadelphia, PA 19101",4706765432," Henry’s QuickWash 1000 washing machine has started to not respond to any button presses on the control panel. He reported that the machine powers on normally, but when he tries to start a wash cycle, none of the buttons work. The display screen also appears frozen, showing a blank screen after the initial power-up. Henry suspects that the control board or touchpad might be malfunctioning, and that this is preventing the machine from operating properly. ",Emily Scott,35 minutes," Emily explained that when a washing machine’s control panel or touchpad becomes unresponsive, it’s often a sign of a control board issue or a problem with the wiring connections. Emily recommended that Henry unplug the machine for a few minutes to reset the system, which might help if the issue was due to a temporary electronic glitch. Since this didn’t resolve the problem, Emily scheduled a technician visit to inspect the control board, touchpad, and the wiring connections for any issues. She noted that if the control board was faulty, it would need to be replaced. ","Yes, technician visit scheduled to inspect the control board and"," Rating: 4 Comments: ""Service was ebicient, but I really need this issue ﬁxed soon as the washing machine is practically unusable right now."" Source System: CRM  ---  ### Customer Service Log 14 Customer Information",
Ava Robinson,11/16/24,793214,ava.robinson@email.com,-5331,"520 Pinehurst Road, San Jose, CA 95128",4710923845," Ava reported that her SuperClean 800 washing machine is having trouble with the spin cycle, as it is not reaching full speed. Despite running a heavy-duty cycle, the clothes remain wet after the spin cycle ﬁnishes. Ava suspects that the issue could be with the drive motor or the spin belt, which she believes may be slipping or failing to engage properly during the spin cycle. She conﬁrmed that the drainage is working ﬁne and that no blockages are present. ",Sarah Morgan,30 minutes," Sarah explained that a washing machine that doesn’t reach full spin speed is often due to a malfunctioning motor or a broken spin belt, both of which can prevent the drum from reaching the correct RPM. Sarah advised Ava to check the spin cycle settings and make sure the machine was not overloaded, as that could also cause the spin cycle to run inebiciently. Since this didn’t resolve the issue, Sarah scheduled a technician visit to inspect the motor, spin belt, and drum assembly. She also advised Ava to avoid using large, heavy loads until the problem was ﬁxed to avoid damaging the system further. ","Yes, technician visit scheduled to inspect the drive motor and spin"," Rating: 5 Comments: ""Great support. I’m conﬁdent the technician will ﬁgure out the issue and ﬁx it."" Source System: CRM  ---  ### Customer Service Log 15 Customer Information",
Lucas Wright,11/17/24,790539,lucas.wright@email.com,-8997,"874 Birch Street, Miami, FL 33139",4709281365," Lucas reported that his WashPro 900 washing machine is consistently overﬁlling with water during the wash cycle, even when he sets it to a low water level. He mentioned that the machine will ﬁll up beyond the normal water line and cause water to overﬂow from the door. Lucas suspects that the issue might be due to a faulty water inlet valve or pressure switch that is not regulating the water ﬂow properly. ",Rachel Bennett,28 minutes," Rachel explained that overﬁlling during the wash cycle is typically caused by a malfunctioning pressure switch or water inlet valve, both of which control the amount of water entering the drum. She recommended that Lucas check for any blockages in the water inlet valve and ensure that the hose was not kinked or obstructed. Since the issue persisted, Rachel arranged for a technician visit to inspect the pressure switch, water inlet valve, and the drainage system to identify the root cause of the overﬁlling issue. ","Yes, technician visit scheduled to inspect the water inlet valve and"," Rating: 3 Comments: ""Support was helpful, but I’ve been dealing with this overﬁlling issue for weeks now. I hope the technician can ﬁx  it soon."" Source System: CRM  ---   ### Customer Service Log 16 Customer Information",
Lily Adams,11/18/24,795023,lily.adams@email.com,-11108,"1070 Spruce Lane, Houston, TX 77001",4713485932," Lily’s SmartWash 900 washing machine is displaying a ""water ﬂow error"" during the initial ﬁlling cycle. She reported that the water does not ﬁll up to the appropriate level, and the machine stops after a few minutes with the error code displayed. Lily conﬁrmed that the water supply is working in her home, and no issues with the pipes were detected. She suspects a malfunction with the water inlet valve or ﬂow sensor. ",Ethan Clarke,15 minutes," Ethan explained that the water ﬂow error is typically caused by issues with the water inlet valve or a faulty ﬂow sensor, both of which control the water supply to the drum. He walked Lily through checking the inlet hose for kinks or obstructions, which could restrict water ﬂow. Since the issue persisted, Ethan escalated the case to the Field Service Management team for an on-site technician visit. The technician would inspect the water inlet valve and ﬂow sensor to identify any malfunction. ","Yes, technician visit scheduled to inspect and replace water inlet"," Rating: 4 Comments: ""The troubleshooting steps were useful, but I hope the technician can ﬁx the issue soon. I need the machine working properly."" Source System: Field Service Management  ---  ### Customer Service Log 17 Customer Information",
