Customer Name,Date,Customer ID,Email Address,Phone Number,Shipping Address,Order Number,Issue Reported,Service Representative,Response Time,Resolution,Follow-up Needed,Customer Feedback,
George Marshall,11/19/24,796521,george.marshall@email.com,-6331,"453 Birchwood Ave, Chicago, IL 60602",4712457890," George reported that his WashMax 3000 washing machine has been making a loud, grinding noise during the spin cycle. The noise has become progressively louder, and George is concerned that it could be a serious mechanical issue. He suspects the noise may be coming from the motor, drum bearings, or the drive belt. He noted that the machine still spins, but the noise is very disruptive. ",Natalie Rogers,25 minutes," Natalie explained that a loud grinding noise during the spin cycle could be caused by worn drum bearings, a loose drive belt, or a faulty motor coupling. She walked George through checking the drum alignment and ensuring that the machine was not overloaded, which could exacerbate the noise. Since the issue was mechanical and likely internal, Natalie scheduled a technician visit through SAP to inspect the motor, drum bearings, and drive belt for any signs of wear or damage. ","Yes, technician visit scheduled to inspect motor, drum bearings,"," Rating: 3 Comments: ""The support was helpful, but I’m concerned about the cost of ﬁxing the motor or bearings. It’s been quite a frustrating experience."" Source System: SAP  ---  ### Customer Service Log 18 Customer Information",
Zoe Carter,11/20/24,797631,zoe.carter@email.com,-5331,"901 Oak Ridge Blvd, Los Angeles, CA 90001",4714579023," Zoe’s QuickSpin 1000 washing machine has an issue with excessive vibrations during the spin cycle, even with small loads. She mentioned that the machine moves across the ﬂoor during the spin, and she has already checked the leveling of the unit, which seems ﬁne. Zoe suspects that the problem could be with the shock absorbers or suspension springs. ",Michael Harris,30 minutes," Michael explained that excessive vibrations during the spin cycle are often due to issues with the shock absorbers or suspension springs, which are responsible for stabilizing the drum during high-speed spinning. He walked Zoe through verifying that the machine was level and balanced, which she conﬁrmed. Michael recommended that Zoe avoid overloading the machine and advised that a technician inspect the shock absorbers and suspension springs for wear or damage. He scheduled the technician visit through Field Service Management to assess and replace the faulty parts. ","Yes, technician visit scheduled to inspect and replace shock"," Rating: 4 Comments: ""The support was helpful, but I hope the technician can resolve the vibration issue soon. It's been annoying trying to balance the machine."" Source System: Field Service Management  ---  ### Customer Service Log 19 Customer Information",
Jack Davis,11/21/24,798234,jack.davis@email.com,-9219,"3500 Maplewood Lane, San Francisco, CA 94105",4720293847," Jack reported that his EcoSpin 600 washing machine is not draining water properly at the end of the wash cycle. The machine completes the cycle, but there is still standing water in the drum. Jack has checked the drain ﬁlter and conﬁrmed that it’s clean, but the issue persists. He suspects the drain pump or drain hose may be clogged. ",Rebecca Foster,22 minutes," Rebecca explained that improper drainage is often caused by issues with the drain pump or a clogged drain hose, which could be obstructing the ﬂow of water. She guided Jack through inspecting the drain hose for any visible blockages. Since the hose was clear, Rebecca suggested that the drain pump might have a fault. She escalated the issue through SAP for a technician visit to inspect and possibly replace the drain pump and verify the entire drainage system. ","Yes, technician visit scheduled to inspect and replace drain pump."," Rating: 5 Comments: ""The troubleshooting steps were helpful, and the technician visit is scheduled quickly. I appreciate the fast response."" Source System: SAP  ---  ### Customer Service Log 20 Customer Information",
Sarah Mitchell,11/22/24,799012,sarah.mitchell@email.com,-4331,"2180 Oakwood Ave, Phoenix, AZ 85001",4723128475," Sarah reported that her TurboWash 5000 washing machine is experiencing intermittent power issues. The machine powers ob unexpectedly mid-cycle and sometimes won’t turn on again without multiple attempts. Sarah noted that the power cord and outlet are ﬁne, and there are no visible signs of a power surge. She suspects a problem with the power supply board or internal wiring. ",Thomas Hill,40 minutes," Thomas explained that intermittent power issues are typically caused by a faulty power supply board or wiring issues that cause the machine to lose connection. He advised Sarah to check if there were any error codes displayed when the power failure occurred, but Sarah conﬁrmed there were none. Since the issue seemed related to the internal components, Thomas arranged a technician visit through Field Service Management to inspect the power supply board and internal wiring for faults and perform any necessary replacements. ","Yes, technician visit scheduled to inspect and replace the power"," Rating: 3 Comments: ""The support was good, but I’m concerned about the internal wiring issue. I’ve had problems with this machine since I got it."" Source System: Field Service Management  ---   ### Customer Service Log 21 Customer Information",
Ben Thompson,11/23/24,799748,ben.thompson@email.com,-2321,"1155 Redwood Lane, Austin, TX 73301",4724657892," Ben reported that his TurboClean 900 washing machine is making a strange beeping noise after every wash cycle. The machine operates normally during the cycle, but the beeping happens when the cycle ﬁnishes, and it continues until the door is opened. Ben conﬁrmed that there is no error code displayed, and the machine is functioning properly otherwise. He suspects it could be a settings issue or something related to software malfunctions. ",Olivia White,20 minutes," Olivia explained that the beeping could be a result of an alert setting indicating that the cycle has completed. She recommended checking the machine’s alarm settings and conﬁrmed that no errors were logged. After troubleshooting, Olivia suggested that the issue might be due to a minor software glitch and escalated the case to SAP for further analysis. A technician was scheduled to check if a ﬁrmware update is needed. ","Yes, technician visit scheduled to check for software issue or"," Rating: 4 Comments: ""The beeping is annoying, but I appreciate the fast response. Hopefully, it’s just a simple ﬁx."" Source System: SAP  ---  ### Customer Service Log 22 Customer Information",
Rachel Clark,11/24/24,800214,rachel.clark@email.com,-6886,"2300 Oak Drive, Boston, MA 02115",4730567884," Rachel reported that her WashPro 600 washing machine has a leaking door seal. She observed that after every wash cycle, there is water around the machine’s door, and it pools on the ﬂoor. Rachel conﬁrmed that the door is properly closed during each cycle, but water still leaks out. She suspects that the door gasket is damaged or worn out. ",John Smith,18 minutes," John explained that a leaking door seal is usually caused by a worn gasket or improper sealing. He advised Rachel to check for any visible cracks or damage on the door seal. Since Rachel conﬁrmed that the gasket seemed worn, John scheduled a Field Service Management technician to inspect the seal and replace the damaged gasket. ","Yes, technician visit scheduled to replace door seal."," Rating: 3 Comments: ""The support was helpful, but I’ve had this problem for a while. I really hope the technician ﬁxes it this time."" Source System: Field Service Management  ---  ### Customer Service Log 23 Customer Information",
Lisa Roberts,11/25/24,801658,lisa.roberts@email.com,-5220,"540 Maplewood Ave, Denver, CO 80202",4731245793," Lisa’s SuperWash 1000 washing machine is not spinning correctly during the ﬁnal rinse. She noted that although the machine agitates during the wash cycle, it fails to spin properly and her clothes are coming out soaking wet. She suspects a malfunction with the spin motor or clutch assembly. ",Charles Miller,22 minutes," Charles explained that the issue is likely related to the spin motor, clutch assembly, or even a broken spin belt. He guided Lisa through checking for any obstructions in the drum or any blockages in the drain hose, but since these appeared clear, he scheduled a technician visit through SAP to inspect the spin motor, clutch, and drain system. ","Yes, technician visit scheduled to inspect spin motor and clutch"," Rating: 4 Comments: ""Good support, but I’m getting frustrated that I can’t use the machine properly. Hope it gets ﬁxed soon."" Source System: SAP  ---  ### Customer Service Log 24 Customer Information",
Amy Wilson,11/26/24,802341,amy.wilson@email.com,-7997,"1805 Pine Ridge Dr, Seattle, WA 98001",4732018439," Amy’s UltraSpin 4000 washing machine is displaying a ""drain error"" after completing a wash cycle. The machine stops draining water and remains stuck in the rinse cycle. Amy mentioned that she has tried checking the ﬁlter and conﬁrmed it’s clean, but the issue persists. She suspects a problem with the drain pump or clogged hose. ",Stephanie Evans,40 minutes," Stephanie advised Amy that a drain error is often caused by a clogged drain hose or a faulty drain pump. She suggested checking if the hose was kinked, but since it wasn’t, she escalated the issue to Field Service Management for a technician visit. The technician would inspect the pump and the drain hose for potential clogs or malfunctions. ","Yes, technician visit scheduled to inspect drain pump and hose."," Rating: 5 Comments: ""Great service, and I’m relieved that the issue is being handled. Looking forward to the technician's visit."" Source System: Field Service Management  ---  ### Customer Service Log 25 Customer Information",
Mark Harris,11/27/24,803547,mark.harris@email.com,-665,"784 Cedar Street, New York, NY 10001",4733349576," Mark reported that his QuickWash 1200 washing machine’s drum is wobbling during spin cycles. The wobbling is so severe that the machine shakes and vibrates against the wall. Mark conﬁrmed that the machine is level and that it’s not overloaded, but the problem persists. He suspects it could be an issue with the suspension system or balance rings. ",Paul Jacobs,15 minutes," Paul explained that a wobbling drum during the spin cycle is often due to issues with the suspension system, shock absorbers, or balance rings that keep the drum steady during high-speed spins. He advised Mark to try redistributing the load during a wash cycle, but since the issue continued, he arranged for a technician visit via SAP to inspect and repair the suspension system and balance rings. ","Yes, technician visit scheduled to inspect suspension system and"," Rating: 4 Comments: ""I’m glad the issue is being taken seriously. Hopefully, the technician can resolve the wobbling soon."" Source System: SAP  ---  ### Customer Service Log 26 Customer Information",
Samuel Green,11/28/24,804412,samuel.green@email.com,-4553,"678 Elmwood Drive, Phoenix, AZ 85001",4734571035," Samuel’s EcoWash 500 washing machine is having issues with water not draining fully during the spin cycle. He reported that the machine completes the wash cycle but leaves a signiﬁcant amount of water in the drum. He conﬁrmed that the ﬁlter is clear, and there are no visible blockages in the drain hose. Samuel suspects the drain pump may be malfunctioning. ",Karen Williams,28 minutes," Karen explained that the issue could likely be caused by a faulty drain pump, which would prevent water from being pumped out during the spin cycle. She advised Samuel to check the drain ﬁlter again and make sure there were no blockages. Since the issue persisted, Karen arranged a Field Service Management technician visit to inspect the drain pump and test its functionality.   ","Yes, technician visit scheduled to inspect and replace drain pump."," Rating: 3 Comments: ""The machine isn’t draining properly, and I’m getting frustrated. I hope the technician can ﬁx this soon."" Source System: Field Service Management  ---  ### Customer Service Log 27 Customer Information",
Helen Brown,11/29/24,805273,helen.brown@email.com,-8442,"302 Birch Street, Atlanta, GA 30301",4735621948," Helen reported that her SpeedWash 300 washing machine’s detergent dispenser is not working correctly. The detergent doesn’t fully dispense, and she noticed that the machine is leaving detergent residue in the compartment. Helen suspects an issue with the water inlet valve or the dispenser system. ",Benjamin Cook,25 minutes," Benjamin advised Helen that the problem is often due to a clogged detergent dispenser or a malfunctioning water inlet valve. He walked Helen through cleaning the dispenser tray and ensuring the water supply was working properly. After conﬁrming the issue persisted, he scheduled a technician visit through SAP to inspect the water inlet valve and ensure the dispenser was functioning correctly. ","Yes, technician visit scheduled to inspect and replace water inlet"," Rating: 5 Comments: ""Thanks for your help. I’m glad this is being addressed quickly. I’m hopeful the technician can resolve the issue."" Source System: SAP  ---  ### Customer Service Log 28 Customer Information",
Henry Smith,11/30/24,806485,henry.smith@email.com,-9886,"442 Pinehill Road, San Jose, CA 95101",4736742017," Henry’s MaxSpin 1000 washing machine is stopping mid-cycle. The machine powers ob unexpectedly during the wash cycle, and sometimes, it won’t start at all. Henry tried resetting the machine and unplugging it, but the issue persists. He suspects a problem with the power board or electrical connections. ",Monica Taylor,35 minutes," Monica explained that sudden power losses mid-cycle are often caused by a faulty power board or a short circuit in the machine’s wiring. She recommended checking the error codes on the display, but since there were none, she scheduled a technician visit through Field Service Management to inspect the power board and electrical components. ","Yes, technician visit scheduled to inspect and replace power board."," Rating: 2 Comments: ""I’m really disappointed with the frequent breakdowns of this machine. I’ve had to call for service several times."" Source System: Field Service Management  ---  ### Customer Service Log 29 Customer Information",
Diana Evans,12/1/24,807220,diana.evans@email.com,-7553,"2001 Aspen Court, Dallas, TX 75001",4737853099," Diana’s QuickClean 700 washing machine is displaying a ""water level sensor"" error. The machine seems to be overﬁlling during cycles, and Diana conﬁrmed that the water level sensor may need to be replaced. She tried recalibrating the machine, but the issue persists. ",Jason Lee,18 minutes," Jason conﬁrmed that a faulty water level sensor could be causing the issue and guided Diana through resetting the sensor. Since resetting didn’t resolve the error, he scheduled a technician visit through SAP to replace the water level sensor and calibrate it. ","Yes, technician visit scheduled to replace water level sensor."," Rating: 4 Comments: ""Good support, but I’m hoping the sensor replacement ﬁxes the problem for good."" Source System: SAP  ---   ### Customer Service Log 30 Customer Information",
Julia Green,12/2/24,808451,julia.green@email.com,-2220,"1250 Hilltop Blvd, Miami, FL 33101",4741102358," Julia’s EcoSpin 2000 washing machine has a persistent odor after each wash cycle, even after running an empty cycle with vinegar. She mentioned that the smell seems to come from the drum, and she suspects there may be mold or mildew buildup, despite cleaning the machine regularly. ",Liam Harris,30 minutes," Liam explained that odors are commonly caused by mold or mildew buildup in the door seal or drum. He advised Julia to check the drain pump ﬁlter and door seal for residue and moisture. After conﬁrming the issue persisted, he scheduled a technician visit via SAP to perform a thorough cleaning and inspection of the drum, pump, and seals to eliminate the odor. ","Yes, technician visit scheduled to clean and inspect drum and"," Rating: 3 Comments: ""I’m disappointed that the smell keeps coming back. I hope the technician can ﬁx it for good."" Source System: SAP  ---  ### Customer Service Log 31 Customer Information",
Darren King,12/3/24,809276,darren.king@email.com,-3998,"9457 Oakwood Drive, Orlando, FL 32801",4742239081," Darren’s SpinMaster 500 washing machine is experiencing dibiculty completing the wash cycle. The machine often gets stuck on the wash phase, and Darren needs to restart the cycle to complete it. He suspects an issue with the motor or timer mechanism. ",Rachel Scott,25 minutes," Rachel explained that a machine stuck on the wash phase is often due to a faulty timer or motor not completing the cycle. She walked Darren through resetting the machine and checking for any error codes. Since the issue persisted, Rachel escalated the issue to Field Service Management for an on-site technician visit. The technician would inspect the motor, timer, and control board to identify the root cause. ","Yes, technician visit scheduled to inspect motor and timer."," Rating: 4 Comments: ""I’m glad the support team is investigating. It’s frustrating to restart the cycle every time."" Source System: Field Service Management  ---  ### Customer Service Log 32 Customer Information",
Martin Edwards,12/4/24,810112,martin.edwards@email.com,-998,"2030 Birchwood St, San Diego, CA 92101",4743247621," Martin’s QuickClean 1500 washing machine is not agitating during the wash cycle. The drum remains still, and the clothes are not being washed properly. Martin checked the agitator and ensured the drum was not overloaded, but the issue persists. ",Sarah White,18 minutes," Sarah explained that a lack of agitation can be caused by a faulty agitator motor, coupling, or belt. She guided Martin through verifying the belt and the agitator for any visible damage. Since the issue continued, Sarah escalated the case to SAP for a technician to inspect the agitator motor and coupling for potential failure. ","Yes, technician visit scheduled to inspect agitator motor and"," Rating: 3 Comments: ""The support was decent, but I really need the agitator ﬁxed. It’s making washing clothes a hassle."" Source System: SAP  ---  ### Customer Service Log 33 Customer Information",
Emily White,12/5/24,811439,emily.white@email.com,-10441,"1287 Sunset Blvd, Los Angeles, CA 90001",4744365920," Emily’s WashSmart 800 washing machine has a noisy spin cycle. The machine makes a loud, high-pitched noise when it reaches full spin speed. Emily conﬁrmed there are no clothes caught in the drum, and the machine seems level. She suspects a problem with the drum bearings or drive belt. ",Greg Stone,27 minutes," Greg explained that the noise is likely caused by worn drum bearings or a loose drive belt. He walked Emily through checking for any visible issues with the belt and drum but conﬁrmed that these appeared ﬁne. Since the noise persisted, he scheduled a Field Service Management technician visit to inspect and possibly replace the drum bearings or drive belt. ","Yes, technician visit scheduled to inspect and replace drum"," Rating: 4 Comments: ""The noise is getting really annoying. Hopefully, the technician can ﬁx it soon."" Source System: Field Service Management  ---  ### Customer Service Log 34 Customer Information",
Patricia Moore,12/6/24,812876,patricia.moore@email.com,-7442,"3564 Oakhill Drive, Atlanta, GA 30301",4745523477," Patricia reported that her SuperWash 1200 washing machine stopped mid-cycle and won’t restart. She mentioned that the machine was working ﬁne until it suddenly turned ob during the rinse cycle. She has tried pressing the reset button and unplugging the machine, but it still won't power back on. ",Jason Brooks,40 minutes," Jason explained that a machine turning ob mid-cycle could be caused by a power board failure, faulty wiring, or overheating protection. He guided Patricia through checking the plug and outlet for issues but conﬁrmed there were none. He then escalated the case to SAP for a technician visit to inspect and possibly replace the power board and test the internal wiring. ","Yes, technician visit scheduled to inspect and replace power board."," Rating: 2 Comments: ""Very frustrating that the machine just turned ob. I’ve had enough of these power issues."" Source System: SAP  ---  ### Customer Service Log 35 Customer Information",
Vanessa James,12/7/24,813492,vanessa.james@email.com,-2442,"2795 Pine View Rd, Chicago, IL 60602",4746601093," Vanessa’s WashPro 2000 washing machine is draining very slowly during the rinse cycle, and the drum is often left with standing water. She conﬁrmed that the ﬁlter is clean, and the drain hose appears clear. She suspects a malfunction in the drain pump or a blockage in the internal pump hose. ",Lisa Clark,33 minutes," Lisa advised Vanessa that slow draining could indicate a faulty drain pump or a blockage in the pump hose. She recommended checking the pump ﬁlter for any residual debris. Since the issue persisted, Lisa scheduled a technician visit via Field Service Management to inspect and test the drain pump and pump hose for clogs or faults. ","Yes, technician visit scheduled to inspect and replace drain pump."," Rating: 5 Comments: ""I’m glad the technician is coming soon. I need the machine to drain properly before I can use it again."" Source System: Field Service Management  ---  ### Customer Service Log 36 Customer Information",
Sophia Evans,2024-12,814256,sophia.evans@email.com,-8664,"1985 Crestwood Lane, Houston, TX 77001",4747703817, Sophia reported that her TurboClean 500 washing machine is having an issue with water temperature. The machine is stuck on cold wash even when she selects a hot water setting. She suspects the heating element or temperature sensor is malfunctioning. ,Robert Turner,22 minutes," Robert explained that a washing machine stuck on cold wash is typically due to a faulty heating element or temperature sensor. He guided Sophia through checking the water inlet valve to ensure it's working properly. Since the problem persisted, Robert arranged for a technician visit via SAP to replace the heating element and test the temperature sensor for functionality. ","Yes, technician visit scheduled to inspect and replace heating"," Rating: 4 Comments: ""I appreciate the support. I just need the temperature issue ﬁxed quickly so I can use the machine again."" Source System: SAP  ---  ### Customer Service Log 37 Customer Information",
Carla Peterson,12/9/24,815774,carla.peterson@email.com,-10997,"1368 Grand Avenue, San Francisco, CA 94110",4748865105," Carla’s EcoWash 1200 washing machine is not ﬁlling with water properly during the wash cycle. The machine starts, but no water enters the drum, leaving the clothes dry. Carla checked the water supply and the inlet valve and conﬁrmed they are both working correctly. ",Matthew Lee,30 minutes," Matthew explained that no water ﬁlling the drum could be caused by a faulty water inlet valve or a clogged ﬁlter. He walked Carla through checking the valve ﬁlter and the supply hoses for blockages. Since the issue persisted, Matthew arranged for a technician visit via Field Service Management to inspect and replace the water inlet valve. ","Yes, technician visit scheduled to inspect and replace water inlet"," Rating: 3 Comments: ""I’m frustrated that the machine isn’t working. I’m hoping the technician can ﬁx the issue soon."" Source System: Field Service Management  ---  ### Customer Service Log 38 Customer Information",
Edward Ross,12/10/24,816042,edward.ross@email.com,-6442,"4507 Pine Hill Road, Portland, OR 97201",4749981340," Edward reported that his SpinWash 1800 washing machine’s door won’t lock properly. The machine starts a wash cycle but stops after a few minutes, showing a door lock error. Edward conﬁrmed that there is no obstruction in the door mechanism, and the door appears aligned. ",Karen Fisher,24 minutes," Karen explained that a door lock error can be caused by a faulty door latch or door lock mechanism. She advised Edward to check for any visible damage to the door components. Since the issue continued, Karen scheduled a technician visit via SAP to inspect and replace the door lock mechanism. ","Yes, technician visit scheduled to inspect and replace door lock."," Rating: 4 Comments: ""The issue seems to be with the door. I hope the technician can get it ﬁxed without much hassle."" Source System: SAP  ---  ### Customer Service Log 39 Customer Information",
Marcus Johnson,12/11/24,817592,marcus.johnson@email.com,-3220,"1584 Redwood Ave, Sacramento, CA 95814",4751112378," Marcus reported that his TurboClean 500 washing machine was not draining at the end of the cycle. He mentioned that there was standing water in the drum after each wash, even though the drain hose was clear. Marcus suspected an issue with the drain pump or ﬁlter. ",Anna Gray,28 minutes," Anna advised Marcus to clean the drain ﬁlter and inspect the hose for any visible clogs. Since the issue persisted, she scheduled a technician visit via Field Service Management to inspect and replace the drain pump if necessary. ","Yes, technician visit scheduled to inspect and replace drain pump."," Rating: 4 Comments: ""I’m frustrated with this issue, but the support was decent. Hopefully the technician can ﬁnally ﬁx it."" Source System: Field Service Management  ---  ### Customer Service Log 40 Customer Information",
